sl_no,category,question,answer
1,Location & Transport,Where is SEAT located?,"""SEAT is located at Gollapalli Road, Chintagunta Village, Near C. Gollapalli, Tirupati (Rural), Andhra Pradesh – 517505."""
2,Location & Transport,Does SEAT provide transport facilities for students?,"""Yes. The institution reportedly operates transport services with 9 buses, including 8 buses from Tirupati and 1 bus from Srikalahasti."""
3,Location & Transport,From which locations are bus services available at SEAT?,The provided material reports bus services from Tirupati and Srikalahasti.
4,Location & Transport,How many buses does SEAT reportedly operate?,SEAT reportedly operates 9 buses for student transport.
5,Student Welfare & Safety,What student welfare and safety systems are available at SEAT?,"""The institution reports an Anti-Ragging Cell, Anti-Drug Cell, Student Grievances Redressal Cell, Women Empowerment Committee, and Gender Equity Cell."""
6,Student Welfare & Safety,Does SEAT have anti-ragging support?,Yes. The institution reports an Anti-Ragging Cell for student safety and grievance handling.
7,Student Welfare & Safety,How can students submit complaints or grievances at SEAT?,The institution reports a Student Grievances Redressal Cell and mentions a grievance login portal.
8,Student Welfare & Safety,Does SEAT provide support systems for women students?,Yes. The institution reports a Women Empowerment Committee and a Gender Equity Cell.
9,Student Welfare & Safety,Does SEAT have medical or health support for students?,Yes. The institution reports a Health Centre/Medical Room for student support.
10,Institution Overview & Accreditation,Is SEAT an autonomous college?,Yes. The provided material indicates that SEAT received autonomous status from 2025.
11,Institution Overview & Accreditation,Which university is SEAT affiliated with?,SEAT is affiliated with Jawaharlal Nehru Technological University Anantapur (JNTUA) for engineering programs.
12,Institution Overview & Accreditation,Is SEAT approved by AICTE?,Yes. The institution reports approval from the All India Council for Technical Education (AICTE).
13,Institution Overview & Accreditation,When was SEAT established?,SEAT was established in 2009.
14,Institution Overview & Accreditation,Where is SEAT located?,"""SEAT is located at Gollapalli Road, Chintagunta Village, Near C. Gollapalli, Tirupati (Rural), Andhra Pradesh – 517505."""
15,Placements,Does SEAT provide placement support for students?,Yes. SEAT reports a Training and Placement (TAP) Cell for placement-related activities and student training.
16,Placements,What placement packages are reported at SEAT?,"""The reported highest package is ₹30 LPA for a CSE student batch. The reported median salary package is ₹3.75 LPA for undergraduate students and ₹3.15 LPA for postgraduate students. The average package was not available in the provided material."""
17,Placements,Which companies reportedly recruit students from SEAT?,"""Reported recruiters include TCS, Infosys, Capgemini, Wipro, IBM, Accenture, HCL Technologies, Tech Mahindra, Mindtree, Bosch, Toyota, OPPO, Hinduja Global Solutions, Experis IT, Avenue IT Solutions, and J-Spiders/Q-Spiders."""
18,Placements,Does SEAT provide placement training?,"Yes. The institution reports placement-related training including aptitude, communication, soft skills, and personality development support, with more than 100 hours of training mentioned."
19,Placements,Who handles placement activities at SEAT and how can students contact them?,"""The institution reports a Training and Placement (TAP) Cell. The provided material mentions Mr. P. Swaminath as Director of Training & Placements. Contact numbers: +91 9502213116 and +91 9885463442. Email: tpo@siddarthaedu.com."""
20,Placements,Does SEAT provide internships or industry exposure?,"""The institution mentions an Industry Institute Interaction Cell supporting industrial visits, guest lectures, corporate interaction, in-plant training, and final-year projects. Internship-specific statistics and stipend details were not available in the provided material."""
21,Placements,What placement history or placement record is reported at SEAT?,"""The institution reports placement activity with recruiters including major IT and engineering companies. The reported highest package is ₹30 LPA and the median salary package is ₹3.75 LPA for undergraduate students."""
22,Placements,Can students from non-CSE branches participate in placements?,"The institution reports placement activities across the college. However, company-wise branch eligibility was not available in the provided material and should be verified with the Training and Placement Cell."
23,Contact & Support,How can I contact SEAT for admission enquiries?,"""SEAT can be contacted at +91 9666200060 or 08647 222011 for institutional enquiries."""
24,Contact & Support,What is the official email address of SEAT?,The provided material mentions principal@siddarthaedu.in as an institutional contact email.
25,Contact & Support,Where is SEAT located?,"""SEAT is located at Gollapalli Road, Chintagunta Village, Near C. Gollapalli, Tirupati (Rural), Andhra Pradesh – 517505."""
26,Contact & Support,How can students contact the Training and Placement Cell at SEAT?,"""The provided material mentions Mr. P. Swaminath (Director of Training & Placements). Contact numbers: +91 9502213116 and +91 9885463442. Email: tpo@siddarthaedu.com."""
27,Contact & Support,How can students submit grievances at SEAT?,The institution reports a Student Grievances Redressal Cell and mentions a grievance login portal.
28,Contact & Support,Does SEAT provide online access to notifications and results?,"Yes. The provided material mentions institutional access for notifications, results, and grievance-related services."
29,Facilities & Labs,What library facilities are available at SEAT?,"""SEAT reports a central library with 30,000+ books, 60+ online journals, 56+ Indian print journals, digital learning resources, OPAC, and seating for approximately 500 students."""
30,Facilities & Labs,Does SEAT provide digital learning resources?,"Yes. The institution reports digital learning resources including e-books, CDs, DVDs, audio-visual learning aids, and a digital library section."
31,Facilities & Labs,What laboratories and learning facilities are available at SEAT?,"""The institution reports department-specific laboratories for practical learning and mentions facilities such as a Microsoft Innovation Lab, R&D Cell, NPTEL Local Chapter, and Centre of Excellence. However, a department-wise lab list was not available in the provided material."""
32,Facilities & Labs,Does SEAT have sports facilities?,"""The institution reports facilities for outdoor games including cricket, football, tennis, and volleyball, along with indoor games facilities."""
33,Facilities & Labs,Does SEAT have an auditorium for events?,Yes. SEAT reports an auditorium named Sir Mokshagundam Visvesvaraya Sabhasthali with audio-visual facilities and a seating capacity reported between 600–1000 students.
34,Facilities & Labs,Does SEAT have medical or wellness facilities?,Yes. The institution reports a Health Centre/Medical Room and a Yoga Centre for student well-being.
35,Facilities & Labs,Does SEAT have a canteen?,"Yes. The institution reports a canteen serving students, staff, and visitors."
36,Academics & Exams,Is SEAT an autonomous college?,Yes. The provided material indicates that SEAT received autonomous status from 2025.
37,Academics & Exams,What does autonomous status mean for students at SEAT?,"With autonomous status from 2025, SEAT can conduct examinations and manage curriculum and evaluation processes under autonomous regulations while remaining affiliated with JNTUA for degree awarding."
38,Academics & Exams,Can students apply for revaluation or recounting at SEAT?,Yes. The institution reports both RC (Recounting) and RV (Revaluation) processes for examination results.
39,Academics & Exams,Does SEAT publish examination notifications and timetables?,"Yes. The institution reports examination notices, timetables, and related notifications through the Exam Branch."
40,Academics & Exams,Can students check semester examination results through SEAT?,Yes. The provided material mentions results access through the institutional system.
41,Academics & Exams,What examination-related services are available at SEAT?,"""The institution reports examination notifications, timetables, results access, fee payment, RC (Recounting), and RV (Revaluation) processes."""
42,Academics & Exams,Does SEAT conduct supplementary examinations?,The provided material mentions supplementary external examinations for B.Tech students.
43,Fees & Scholarships,Does SEAT support scholarships or fee reimbursement?,The provided material mentions scholarship and fee reimbursement support for eligible students. Exact eligibility and scheme details should be verified directly with the institution.
44,Fees & Scholarships,Can students get fee reimbursement at SEAT?,"The provided material mentions fee reimbursement support for eligible students. Students should verify eligibility, income limits, and applicable rules directly with the institution."
45,Fees & Scholarships,Will scholarship or fee reimbursement cover hostel fees?,The provided material did not specify whether hostel fees are covered under scholarship or reimbursement schemes. Students should verify this directly with the institution.
46,Fees & Scholarships,What documents may be required for scholarship or fee reimbursement?,"""The provided material mentions that students may need caste certificate, income certificate, Aadhaar card, and academic documents as applicable."""
47,Fees & Scholarships,What fee-related details should students verify before joining SEAT?,"""Students should verify tuition fee, hostel fee, transport fee, examination fee, refund policy, and scholarship eligibility directly with the institution."""
48,Fees & Scholarships,Can management quota students receive scholarship or reimbursement benefits?,The provided material did not specify scholarship eligibility for management quota students. Students should verify this directly with the institution.
49,Hostel & Student Life,Does SEAT provide hostel facilities for students?,"""Yes. SEAT reports separate hostel facilities for boys and girls students. The boys hostel has an approximate capacity of 300 students and is reportedly located within the campus, while the girls hostel has an approximate capacity of 246 students and is reportedly located outside the campus."""
50,Hostel & Student Life,How are hostel rooms allotted at SEAT?,The provided material states that hostel rooms are generally allotted on a sharing basis.
51,Hostel & Student Life,Are wardens available in SEAT hostels?,Yes. The provided material mentions warden support for hostel facilities.
52,Hostel & Student Life,Are hostel fee details available for SEAT?,Hostel fee details were not available in the provided material and should be verified directly with the institution.
53,Hostel & Student Life,Does SEAT provide transport facilities for students?,"""Yes. The institution reportedly operates transport services with 9 buses, including 8 buses from Tirupati and 1 bus from Srikalahasti."""
54,Hostel & Student Life,What student clubs and activities are available at SEAT?,"""The institution mentions IEEE, ACM, CSI, SAE, NSS, Eco Club, Consumer Club, Math Club, Physics Club, English Club, Tech Delight Club, Energy Club, and Fine Arts Club."""
55,Hostel & Student Life,What student welfare and safety systems are available at SEAT?,"""The institution reports an Anti-Ragging Cell, Anti-Drug Cell, Student Grievances Redressal Cell, Women Empowerment Committee, and Gender Equity Cell."""
56,Hostel & Student Life,Does SEAT have sports facilities?,"""The institution reports facilities for outdoor games including cricket, football, tennis, and volleyball, along with indoor games facilities."""
57,Branch Selection,What B.Tech branches are available at SEAT?,"""SEAT offers CSE, Artificial Intelligence (AI), Artificial Intelligence & Machine Learning (AI&ML), Data Science, ECE, EEE, Mechanical Engineering, and Civil Engineering."""
58,Branch Selection,What rank is needed for CSE at SEAT?,The reported 2024 Round-1 benchmark for CSE was approximately 114109.
59,Branch Selection,What rank is needed for ECE at SEAT?,The reported 2024 Round-1 benchmark for ECE was approximately 135664.
60,Branch Selection,What rank is needed for AI or AI&ML at SEAT?,"""The reported 2024 Round-1 benchmark was approximately 145728 for AI and 171045 for AI&ML."""
61,Branch Selection,Which branch had the most competitive reported cutoff at SEAT in 2024?,"Among the reported Round-1 benchmarks in 2024, CSE had the lowest closing rank at approximately 114109."
62,Branch Selection,Does SEAT offer branches related to Artificial Intelligence?,Yes. SEAT offers Artificial Intelligence (AI) and Artificial Intelligence & Machine Learning (AI&ML) programs.
63,Branch Selection,Can ECE students get software-related opportunities?,The provided material notes that ECE students may have opportunities in both electronics-related and software-related placements.
64,Branch Selection,Does SEAT offer postgraduate programs besides B.Tech?,"""Yes. SEAT offers MBA, M.Tech, and physical education programs such as B.P.Ed, D.P.Ed, and M.P.Ed."""
65,Branch Selection,Are department-wise placement statistics available for each branch?,Department-wise placement statistics were not available in the provided material.
66,Branch Selection,Where can students verify branch-specific placement details?,Students should directly verify branch-specific placement information with the Training and Placement Cell or institution.
67,Admissions,How can I get admission into SEAT?,B.Tech admissions at SEAT are conducted through AP EAPCET counselling.
68,Admissions,What entrance exam is required for B.Tech admission at SEAT?,B.Tech admissions at SEAT are conducted through AP EAPCET (formerly AP EAMCET).
69,Admissions,Can I join SEAT without AP EAPCET or through management quota?,"""The provided material mentions management quota admissions. Students should contact the institution directly to verify eligibility, admission process, and fee details."""
70,Admissions,What is the admission process for B.Tech at SEAT?,"""Students participate in AP EAPCET counselling, select web options, and may receive a seat allotment based on rank and availability."""
71,Admissions,What documents are required during admission at SEAT?,"""Students should keep SSC/10th memo, Intermediate marks memo, rank card, hall ticket, Aadhaar card, passport-size photographs, and applicable caste/income certificates ready."""
72,Admissions,Can diploma students join directly into second year B.Tech at SEAT?,"""The provided material mentions lateral entry admissions for diploma students into the second year of B.Tech programs."""
73,Admissions,What is the minimum qualification for B.Tech admission at SEAT?,"""Students should have completed Intermediate (10+2) or diploma as mentioned in the provided material."""
74,Admissions,What B.Tech branches are available at SEAT?,"""SEAT offers CSE, AI, AI&ML, Data Science, ECE, EEE, Mechanical Engineering, and Civil Engineering."""
75,Admissions,What are the reported cutoff ranks for B.Tech branches at SEAT?,"""The reported 2024 Round-1 benchmarks were approximately: CSE – 114109, EEE – 126793, ECE – 135664, Mechanical – 142900, AI – 145728, Civil – 152607, and AI&ML – 171045."""
76,Admissions,Can cutoff ranks change every year?,"Yes. The provided material notes that cutoff ranks may vary depending on demand, seat availability, and counselling rounds."
77,Admissions,What entrance exams are required for MBA and M.Tech admissions at SEAT?,"""MBA admissions at SEAT are conducted through AP ICET, while M.Tech admissions are conducted through AP PGECET."""
78,Admissions,What documents are important for scholarship-related admission processes?,"""Students may need caste certificate, income certificate, Aadhaar card, and academic documents as applicable."""
79,Admissions,How can students contact SEAT for admission enquiries?,"""Students can contact SEAT through the institutional enquiry channels. The institution is located at Gollapalli Road, Chintagunta Village, Near C. Gollapalli, Tirupati (Rural), Andhra Pradesh – 517505."""
